Title,Authors,Year,Venue,Index
chorochronos: a research network for spatiotemporal database systems,"andrew frank, stephane grumbach, ralf hartmut güting, christian s. jensen, manolis koubarakis, nikos lorentzos, yannis manolopoulos, enrico nardelli, barbara pernici, hans-jörg schek, michel scholl, timos sellis, babis theodoulidis, peter widmayer",1999,acm sigmod record,539087fe20f70186a0d758e1
database research at the university of oklahoma,"le gruenwald, leonard brown, ravi dirckze, sylvain guinepain, carlos sanchez, brian summers, sirirut vanichayobon",1999,acm sigmod record,539087fe20f70186a0d758e8
an overview and classification of mediated query systems,"ruxandra domenig, klaus r. dittrich",1999,acm sigmod record,539087fe20f70186a0d758e7
distributed transactions in practice,"prabhu ram, lyman do, pamela drew",1999,acm sigmod record,539087fe20f70186a0d758e5
first-class views: a key to user-centered computing,"arnon rosenthal, edward sciore",1999,acm sigmod record,539087fe20f70186a0d758e3
acm sigmod record,michael franklin,1999,acm sigmod record,558fe4a80cf2e9668dc4c9d6
on the content of materialized aggregate views,"stéphane grumbach, leonardo tininini",2000,pods '00 proceedings of the nineteenth acm sigmod-sigact-sigart symposium on principles of database systems,539087fe20f70186a0d75e26
typechecking for xml transformers,"tova milo, dan suciu, victor vianu",2000,pods '00 proceedings of the nineteenth acm sigmod-sigact-sigart symposium on principles of database systems,539087fe20f70186a0d75e23
acm sigmod record,"weidong chen, jeffrey naughton, philip a. bernstein",2000,acm sigmod record,558e13df0cf2c779a6476f31
the web as a graph,"ravi kumar, prabhakar raghavan, sridhar rajagopalan, d. sivakumar, andrew tompkins, eli upfal",2000,pods '00 proceedings of the nineteenth acm sigmod-sigact-sigart symposium on principles of database systems,539087fe20f70186a0d75e22
auditing boolean attributes,"jon kleinberg, christos papadimitriou, prabhakar raghavan",2000,pods '00 proceedings of the nineteenth acm sigmod-sigact-sigart symposium on principles of database systems,539087fe20f70186a0d75e3f
dtd inference for views of xml data,"yannis papakonstantinou, victor vianu",2000,pods '00 proceedings of the nineteenth acm sigmod-sigact-sigart symposium on principles of database systems,539087fe20f70186a0d75e25
fixed-point query languages for linear constraint databases,stephan kreutzer,2000,pods '00 proceedings of the nineteenth acm sigmod-sigact-sigart symposium on principles of database systems,539087fe20f70186a0d75e42
computational aspects of resilient data extraction from semistructured sources (extended abstract),"hasan davulcu, guizhen yang, michael kifer, i. v. ramakrishnan",2000,pods '00 proceedings of the nineteenth acm sigmod-sigact-sigart symposium on principles of database systems,539087fe20f70186a0d75e44
entrepreneurship for information systems researchers (invited tutorial) (abstract only),ashish gupta,2000,pods '00 proceedings of the nineteenth acm sigmod-sigact-sigart symposium on principles of database systems,539087fe20f70186a0d75e4a
expressive power and data complexity of nonrecursive query languages for lists and trees (extended abstract),"evgeny dantsin, andrei voronkov",2000,pods '00 proceedings of the nineteenth acm sigmod-sigact-sigart symposium on principles of database systems,539087fe20f70186a0d75e46
on herbrand semantics and conflict serializability of read-write transactions (extended abstract),"jens lechtenbörger, gottfried vossen",2000,pods '00 proceedings of the nineteenth acm sigmod-sigact-sigart symposium on principles of database systems,539087fe20f70186a0d75e49
linear approximation of planar spatial databases using transitive-closure logic,"floris geerts, bart kuijpers",2000,pods '00 proceedings of the nineteenth acm sigmod-sigact-sigart symposium on principles of database systems,539087fe20f70186a0d75e43
(almost) optimal parallel block access to range queries,"mikhail j. atallah, sunil prabhakar",2000,pods '00 proceedings of the nineteenth acm sigmod-sigact-sigart symposium on principles of database systems,539087fe20f70186a0d75e4c
expressive and efficient pattern languages for tree-structured data (extended abstract),"frank neven, thomas schwentick",2000,pods '00 proceedings of the nineteenth acm sigmod-sigact-sigart symposium on principles of database systems,539087fe20f70186a0d75e45
analysis and application of adaptive sampling,james f. lynch,2000,pods '00 proceedings of the nineteenth acm sigmod-sigact-sigart symposium on principles of database systems,539087fe20f70186a0d75e51
computational properties of metaquerying problems,"f. angiulli, r. ben-eliyahu-zohary, l. palopoli, g. b. ianni",2000,pods '00 proceedings of the nineteenth acm sigmod-sigact-sigart symposium on principles of database systems,539087fe20f70186a0d75e4f
uniform generation in spatial constraint databases and applications (extended abstract),"david gross, michel de rougemont",2000,pods '00 proceedings of the nineteenth acm sigmod-sigact-sigart symposium on principles of database systems,539087fe20f70186a0d75e50
indexing moving points (extended abstract),"pankaj k. agarwal, lars arge, jeff erickson",2000,pods '00 proceedings of the nineteenth acm sigmod-sigact-sigart symposium on principles of database systems,539087fe20f70186a0d75e48
transversing itemset lattices with statistical metric pruning,"shinichi morishita, jun sese",2000,pods '00 proceedings of the nineteenth acm sigmod-sigact-sigart symposium on principles of database systems,539087fe20f70186a0d75e4e
towards estimation error guarantees for distinct values,"moses charikar, surajit chaudhuri, rajeev motwani, vivek narasayya",2000,pods '00 proceedings of the nineteenth acm sigmod-sigact-sigart symposium on principles of database systems,539087fe20f70186a0d75e52
selectively estimation for boolean queries,"zhiyuan chen, nick koudas, flip korn, s. muthukrishnan",2000,pods '00 proceedings of the nineteenth acm sigmod-sigact-sigart symposium on principles of database systems,539087fe20f70186a0d75e4d
optimal histograms for hierarchical range queries (extended abstract),"nick koudas, s. muthukrishnan, divesh srivastava",2000,pods '00 proceedings of the nineteenth acm sigmod-sigact-sigart symposium on principles of database systems,539087fe20f70186a0d75e4b
indexing the edges—a simple and yet efficient approach to high-dimensional indexing,"beng chin ooi, kian-lee tan, cui yu, stephane bressan",2000,pods '00 proceedings of the nineteenth acm sigmod-sigact-sigart symposium on principles of database systems,539087fe20f70186a0d75e47
view-based query processing for regular path queries with inverse,"diego calvanese, moshe y. vardi, giuseppe de giacomo, maurizio lenzerini",2000,pods '00 proceedings of the nineteenth acm sigmod-sigact-sigart symposium on principles of database systems,539087fe20f70186a0d75e3c
query containment for data integration systems,"todd millstein, alon levy, marc friedman",2000,pods '00 proceedings of the nineteenth acm sigmod-sigact-sigart symposium on principles of database systems,539087fe20f70186a0d75e3d
constraint satisfaction and database theory: a tutorial,moshe y. vardi,2000,pods '00 proceedings of the nineteenth acm sigmod-sigact-sigart symposium on principles of database systems,539087fe20f70186a0d75e3e
reachability and connectivity queries in constraint databases,"michael benedikt, martin grohe, leonid libkin, luc segoufin",2000,pods '00 proceedings of the nineteenth acm sigmod-sigact-sigart symposium on principles of database systems,539087fe20f70186a0d75e41
data mining on an oltp system (nearly) for free,"erik riedel, christos faloutsos, gregory r. ganger, david f. nagle",2000,sigmod '00 proceedings of the 2000 acm sigmod international conference on management of data,5390880220f70186a0d75ed8
verification of relational tranducers for electronic commerce,marc spielmann,2000,pods '00 proceedings of the nineteenth acm sigmod-sigact-sigart symposium on principles of database systems,539087fe20f70186a0d75e40
high speed on-line backup when using logical log operations,david b. lomet,2000,sigmod '00 proceedings of the 2000 acm sigmod international conference on management of data,5390880220f70186a0d75edb
efficient resumption of interrupted warehouse loads,"wilburt juan labio, janet l. wiener, hector garcia-molina, vlad gorelik",2000,sigmod '00 proceedings of the 2000 acm sigmod international conference on management of data,5390880220f70186a0d75edc
on-line reorganization in object databases,"mohana k. lakhamraju, rajeev rastogi, s. seshadri, s. sudarshan",2000,sigmod '00 proceedings of the 2000 acm sigmod international conference on management of data,5390880220f70186a0d75ede
integrity constraints for xml,"wenfei fan, jérôme siméon",2000,pods '00 proceedings of the nineteenth acm sigmod-sigact-sigart symposium on principles of database systems,539087fe20f70186a0d75e24
turbo-charging vertical mining of large databases,"pradeep shenoy, jayant r. haritsa, s. sudarshan, gaurav bhalotia, mayank bawa, devavrat shah",2000,sigmod '00 proceedings of the 2000 acm sigmod international conference on management of data,5390880220f70186a0d75ed9
density biased sampling: an improved method for data mining and clustering,"christopher r. palmer, christos faloutsos",2000,sigmod '00 proceedings of the 2000 acm sigmod international conference on management of data,5390880220f70186a0d75ee1
answering complex sql queries using automatic summary tables,"markos zaharioudakis, roberta cochrane, george lapis, hamid pirahesh, monica urata",2000,sigmod '00 proceedings of the 2000 acm sigmod international conference on management of data,5390880220f70186a0d75ee7
how to roll a join: asynchronous incremental view maintenance,"kenneth salem, kevin beyer, bruce lindsay, roberta cochrane",2000,sigmod '00 proceedings of the 2000 acm sigmod international conference on management of data,5390880220f70186a0d75eea
synchronizing a database to improve freshness,"junghoo cho, hector garcia-molina",2000,sigmod '00 proceedings of the 2000 acm sigmod international conference on management of data,5390880220f70186a0d75ee8
finding generalized projected clusters in high dimensional spaces,"charu c. aggarwal, philip s. yu",2000,sigmod '00 proceedings of the 2000 acm sigmod international conference on management of data,5390880220f70186a0d75ee0
on wrapping query languages and efficient xml integration,"vassilis christophides, sophie cluet, jérǒme simèon",2000,sigmod '00 proceedings of the 2000 acm sigmod international conference on management of data,5390880220f70186a0d75eec
mocha: a self-extensible database middleware system for distributed data sources,"manuel rodríguez-martínez, nick roussopoulos",2000,sigmod '00 proceedings of the 2000 acm sigmod international conference on management of data,5390880220f70186a0d75efe
microsoft terraserver: a spatial data warehouse,"tom barclay, jim gray, don slutz",2000,sigmod '00 proceedings of the 2000 acm sigmod international conference on management of data,5390880220f70186a0d75f08
lh*rs: a high-availability scalable distributed data structure using reed solomon codes,"witold litwin, thomas schwarz",2000,sigmod '00 proceedings of the 2000 acm sigmod international conference on management of data,5390880220f70186a0d75f02
xtract: a system for extracting document type descriptors from xml documents,"minos garofalakis, aristides gionis, rajeev rastogi, s. seshadri, kyuseok shim",2000,sigmod '00 proceedings of the 2000 acm sigmod international conference on management of data,5390880220f70186a0d75efa
spatial join selectivity using power laws,"christos faloutsos, bernhard seeger, agma traina, caetano traina, jr.",2000,sigmod '00 proceedings of the 2000 acm sigmod international conference on management of data,5390880220f70186a0d75efd
towards self-tuning data placement in parallel database systems,"mong li lee, masaru kitsuregawa, beng chin ooi, kian-lee tan, anirban mondal",2000,sigmod '00 proceedings of the 2000 acm sigmod international conference on management of data,5390880220f70186a0d75f01
closest pair queries in spatial databases,"antonio corral, yannis manolopoulos, yannis theodoridis, michael vassilakopoulos",2000,sigmod '00 proceedings of the 2000 acm sigmod international conference on management of data,5390880220f70186a0d75eff
adaptive multi-stage distance join processing,"hyoseop shin, bongki moon, sukho lee",2000,sigmod '00 proceedings of the 2000 acm sigmod international conference on management of data,5390880220f70186a0d75f0c
wsq/dsq: a practical approach for combined querying of databases and the web,"roy goldman, jennifer widom",2000,sigmod '00 proceedings of the 2000 acm sigmod international conference on management of data,5390880220f70186a0d75f06
a chase too far?,"lucian popa, alin deutsch, arnaud sahuguet, val tannen",2000,sigmod '00 proceedings of the 2000 acm sigmod international conference on management of data,5390880220f70186a0d75f05
a framework for expressing and combining preferences,"rakesh agrawal, edward l. wimmers",2000,sigmod '00 proceedings of the 2000 acm sigmod international conference on management of data,5390880220f70186a0d75f07
efficient and extensible algorithms for multi query optimization,"prasan roy, s. seshadri, s. sudarshan, siddhesh bhobe",2000,sigmod '00 proceedings of the 2000 acm sigmod international conference on management of data,5390880220f70186a0d75f03
influence sets based on reverse nearest neighbor queries,"flip korn, s. muthukrishnan",2000,sigmod '00 proceedings of the 2000 acm sigmod international conference on management of data,5390880220f70186a0d75f00
lof: identifying density-based local outliers,"markus m. breunig, hans-peter kriegel, raymond t. ng, jörg sander",2000,sigmod '00 proceedings of the 2000 acm sigmod international conference on management of data,5390880220f70186a0d75ee5
xmill: an efficient compressor for xml data,"hartmut liefke, dan suciu",2000,sigmod '00 proceedings of the 2000 acm sigmod international conference on management of data,5390880220f70186a0d75ef6
a data model and data structures for moving objects databases,"luca forlizzi, ralf hartmut güting, enrico nardelli, markus schneider",2000,sigmod '00 proceedings of the 2000 acm sigmod international conference on management of data,5390880220f70186a0d75f0a
eddies: continuously adaptive query processing,"ron avnur, joseph m. hellerstein",2000,sigmod '00 proceedings of the 2000 acm sigmod international conference on management of data,5390880220f70186a0d75f04
indexing the positions of continuously moving objects,"simonas šaltenis, christian s. jensen, scott t. leutenegger, mario a. lopez",2000,sigmod '00 proceedings of the 2000 acm sigmod international conference on management of data,5390880220f70186a0d75f0b
mining frequent patterns without candidate generation,"jiawei han, jian pei, yiwen yin",2000,sigmod '00 proceedings of the 2000 acm sigmod international conference on management of data,5390880220f70186a0d75ed5
challenges in automating declarative business rules to enable rapid business response,val huber,2000,sigmod '00 proceedings of the 2000 acm sigmod international conference on management of data,5390880220f70186a0d75f25
going beyond personalization: rule engines at work,eric kintzer,2000,sigmod '00 proceedings of the 2000 acm sigmod international conference on management of data,5390880220f70186a0d75f29
benchmarking queries over trees: learning the hard truth the hard way,"fanny wattez, sophie cluet, véronique benzaken, guy ferran, christian fiegel",2000,sigmod '00 proceedings of the 2000 acm sigmod international conference on management of data,5390880220f70186a0d75f22
expressing business rules,ronald g. ross,2000,sigmod '00 proceedings of the 2000 acm sigmod international conference on management of data,5390880220f70186a0d75f27
"counting, enumerating, and sampling of execution plans in a cost-based query optimizer","florian waas, césar galindo-legaria",2000,sigmod '00 proceedings of the 2000 acm sigmod international conference on management of data,5390880220f70186a0d75f21
on effective multi-dimensional indexing for strings,"h. v. jagadish, nick koudas, divesh srivastava",2000,sigmod '00 proceedings of the 2000 acm sigmod international conference on management of data,5390880220f70186a0d75f12
finding replicated web collections,"junghoo cho, narayanan shivakumar, hector garcia-molina",2000,sigmod '00 proceedings of the 2000 acm sigmod international conference on management of data,5390880220f70186a0d75f0d
from browsing to interacting: dbms support for responsive websites,raghu ramakrishnan,2000,sigmod '00 proceedings of the 2000 acm sigmod international conference on management of data,5390880220f70186a0d75f35
anatomy of a real e-commerce system,anant jhingran,2000,sigmod '00 proceedings of the 2000 acm sigmod international conference on management of data,5390880220f70186a0d75f33
maintenance of cube automatic summary tables,"wolfgang lehner, richard sidle, hamid pirahesh, roberta wolfgang cochrane",2000,sigmod '00 proceedings of the 2000 acm sigmod international conference on management of data,5390880220f70186a0d75f24
application architecture (panel session): 2tier or 3tier? what is dbms's role?,anil k. nori,2000,sigmod '00 proceedings of the 2000 acm sigmod international conference on management of data,5390880220f70186a0d75f38
designing and mining multi-terabyte astronomy archives: the sloan digital sky survey,"alexander s. szalay, peter z. kunszt, ani thakar, jim gray, don slutz, robert j. brunner",2000,sigmod '00 proceedings of the 2000 acm sigmod international conference on management of data,5390880220f70186a0d75f16
index research (panel session): forest or trees?,"joseph m. hellerstein, hans-peter kriegel, david comet, christos falsutsos, raghu ramakrishnan, paul brown",2000,sigmod '00 proceedings of the 2000 acm sigmod international conference on management of data,5390880220f70186a0d75f37
sqlem: fast clustering in sql using the em algorithm,"carlos ordonez, paul cereghini",2000,sigmod '00 proceedings of the 2000 acm sigmod international conference on management of data,5390880220f70186a0d75f32
internet traffic warehouse,"chung-min chen, munir cochinwala, claudio petrone, marc pucci, sunil samtani, patrizia santa",2000,sigmod '00 proceedings of the 2000 acm sigmod international conference on management of data,5390880220f70186a0d75f30
the onion technique: indexing for linear optimization queries,"yuan-chi chang, lawrence bergman, vittorio castelli, chung-sheng li, ming-ling lo, john r. smith",2000,sigmod '00 proceedings of the 2000 acm sigmod international conference on management of data,5390880220f70186a0d75f11
data access (tutorial session),"josé a. blakeley, anand deshpande",2000,sigmod '00 proceedings of the 2000 acm sigmod international conference on management of data,5390880220f70186a0d75f3e
efficient and cost-effective techniques for browsing and indexing large video databases,"junghwan oh, kien a. hua",2000,sigmod '00 proceedings of the 2000 acm sigmod international conference on management of data,5390880220f70186a0d75f13
designing an ultra highly available dbms (tutorial session),"svein erik bratsberg, øystein torbjørnsen",2000,sigmod '00 proceedings of the 2000 acm sigmod international conference on management of data,5390880220f70186a0d75f3b
serfing the web: web site management made easy,"elke a. rundensteiner, kajal t. claypool, li chen, hong su, keiji oenoki",2000,sigmod '00 proceedings of the 2000 acm sigmod international conference on management of data,5390880220f70186a0d75f4e
handling very large databases with informix extended parallel server,andreas weininger,2000,sigmod '00 proceedings of the 2000 acm sigmod international conference on management of data,5390880220f70186a0d75f2f
self-organizing data sharing communities with sagres,"zachary ives, alon levy, jayant madhavan, rachel pottinger, stefan saroiu, igor tatarinov, shiori betzler, qiong chen, ewa jaslikowska, jing su, wai tak theodora yeung",2000,sigmod '00 proceedings of the 2000 acm sigmod international conference on management of data,5390880220f70186a0d75f4a
congressional samples for approximate answering of group-by queries,"swarup acharya, phillip b. gibbons, viswanath poosala",2000,sigmod '00 proceedings of the 2000 acm sigmod international conference on management of data,5390880220f70186a0d75f20
&lgr;-db: an odmg-based object-oriented dbms,"leonidas fegaras, chandrasekhar srinivasan, arvind rajendran, david maier",2000,sigmod '00 proceedings of the 2000 acm sigmod international conference on management of data,5390880220f70186a0d75f4c
an approximate search engine for structural databases,"jason t. l. wang, xiong wang, dennis shasha, bruce a. shapiro, kaizhong zhang, qicheng ma, zasha weinberg",2000,sigmod '00 proceedings of the 2000 acm sigmod international conference on management of data,5390880220f70186a0d75f4d
indexing images in oracle8i,"melliyal annamalai, rajiv chopra, samuel defazio, susan mavris",2000,sigmod '00 proceedings of the 2000 acm sigmod international conference on management of data,5390880220f70186a0d75f2d
online index rebuild,"nagavamsi ponnekanti, hanuma kodavalla",2000,sigmod '00 proceedings of the 2000 acm sigmod international conference on management of data,5390880220f70186a0d75f2c
niagaracq: a scalable continuous query system for internet databases,"jianjun chen, david j. dewitt, feng tian, yuan wang",2000,sigmod '00 proceedings of the 2000 acm sigmod international conference on management of data,5390880220f70186a0d75f10
dlfm: a transactional resource manager,"hui-i hsiao, inderpal narang",2000,sigmod '00 proceedings of the 2000 acm sigmod international conference on management of data,5390880220f70186a0d75f2b
efficient algorithms for mining outliers from large data sets,"sridhar ramaswamy, rajeev rastogi, kyuseok shim",2000,sigmod '00 proceedings of the 2000 acm sigmod international conference on management of data,5390880220f70186a0d75f14
privacy-preserving data mining,"rakesh agrawal, ramakrishnan srikant",2000,sigmod '00 proceedings of the 2000 acm sigmod international conference on management of data,5390880220f70186a0d75f15
approximating multi-dimensional aggregate range queries over real attributes,"dimitrios gunopulos, george kollios, vassilis j. tsotras, carlotta domeniconi",2000,sigmod '00 proceedings of the 2000 acm sigmod international conference on management of data,5390880220f70186a0d75f1e
homer: a model-based case tool for data-intensive web sites,"paolo merialdo, paolo atzeni, marco magnante, giansalvatore mecca, marco pecorone",2000,sigmod '00 proceedings of the 2000 acm sigmod international conference on management of data,5390880220f70186a0d75f4f
making b+- trees cache conscious in main memory,"jun rao, kenneth a. ross",2000,sigmod '00 proceedings of the 2000 acm sigmod international conference on management of data,5390880220f70186a0d75f1f
ldap directory services- just another database application? (tutorial session),"shridhar shukla, anand deshpande",2000,sigmod '00 proceedings of the 2000 acm sigmod international conference on management of data,5390880220f70186a0d75f40
webview materialization,"alexandros labrinidis, nick roussopoulos",2000,sigmod '00 proceedings of the 2000 acm sigmod international conference on management of data,5390880220f70186a0d75f0e
"data management in ecommerce (tutorial session): the good, the bad, and the ugly",avigdor gal,2000,sigmod '00 proceedings of the 2000 acm sigmod international conference on management of data,5390880220f70186a0d75f3d
research issues in moving objects databases (tutorial session),ouri wolfson,2000,sigmod '00 proceedings of the 2000 acm sigmod international conference on management of data,5390880220f70186a0d75f42
of xml and databases (panel session): where's the beef?,"jennifer widom, adam bosworth, bruce lindsay, michael stonebraker, dan suciu, michael j. carey",2000,sigmod '00 proceedings of the 2000 acm sigmod international conference on management of data,5390880220f70186a0d75f3a
information dependencies,"mehmet m. dalkilic, edward l. roberston",2000,pods '00 proceedings of the nineteenth acm sigmod-sigact-sigart symposium on principles of database systems,5390880220f70186a0d76124
fact: a learning based web query processing system,"songting chen, yanlei diao, hongjun lu, zengping tian",2000,sigmod '00 proceedings of the 2000 acm sigmod international conference on management of data,5390880220f70186a0d762e6
javax.xxl: a prototype for a library of query processing algorithms,"jochen van den bercken, jens-peter dittrich, bernhard seeger",2000,sigmod '00 proceedings of the 2000 acm sigmod international conference on management of data,5390880220f70186a0d762e8
"i3: intelligent, interactive investigation of olap data cubes","sunita sarawagi, gayatri sathe",2000,sigmod '00 proceedings of the 2000 acm sigmod international conference on management of data,5390880220f70186a0d762ea
concept based design of data warehouses: the dwq demonstrators,"m. jarke, c. quix, d. calvanese, m. lenzerini, e. franconi, s. ligoudistianos, p. vassiliadis, y. vassiliou",2000,sigmod '00 proceedings of the 2000 acm sigmod international conference on management of data,5390880220f70186a0d762f0
mocha: a database middleware system featuring automatic deployment of application-specific functionality,"manuel rodríguez-martínez, nick roussopoulos, john m. mcgann, stephen kelley, vadim katz, zhexuan song, joseph jájá",2000,sigmod '00 proceedings of the 2000 acm sigmod international conference on management of data,5390880220f70186a0d762f5
ajax: an extensible data cleaning tool,"helena galhardas, daniela florescu, dennis shasha, eric simon",2000,sigmod '00 proceedings of the 2000 acm sigmod international conference on management of data,5390880220f70186a0d762ee
