Title,Authors,Year,Venue,Index
on the expressive power of datalog: tools and a case study,"phokion g. kolaitis, moshe y. vardi",1995,selected papers of the 9th annual acm sigact-sigmod-sigart symposium on principles of database systems,539087cf20f70186a0d5b201
optimizing jan jannink's implementation of b+-tree deletion,"r. maelbrancke, h. olivié",1995,acm sigmod record,539087cf20f70186a0d5b52d
multi-table joins through bitmapped join indices,"patrick o'neil, goetz graefe",1995,acm sigmod record,539087cf20f70186a0d5b52f
design and user testing of a multi-paradigm query interface to an object-oriented database,"dac khoa doan, norman w. paton, alistair kilgour",1995,acm sigmod record,539087cf20f70186a0d5b531
mapping extended entity relationship model to object modeling technique,joseph fong,1995,acm sigmod record,539087cf20f70186a0d5b535
normalization in oodb design,byung s. lee,1995,acm sigmod record,539087cf20f70186a0d5b536
response to “a close look at the ifo data model”,"serge abiteboul, richard hull",1995,acm sigmod record,539087cf20f70186a0d5b528
acm sigmod record,jennifer widom,1995,acm sigmod record,558fe32f0cf23515427181af
an introduction to remy's fast polymorphic record projection,limsoon wong,1995,acm sigmod record,539087cf20f70186a0d5b53b
on the issue of valid time(s) in temporal databases,"stavros kokkotos, efstathios v. ioannidis, themis panayiotopoulos, constantine d. spyropoulos",1995,acm sigmod record,539087cf20f70186a0d5b53c
addressing techniques used in database object managers o2 and orion,"andré gamache, nadjiba sahraoui",1995,acm sigmod record,539087cf20f70186a0d5b53e
a framework for providing consistent and recoverable agent-based access to heterogeneous mobile databases,"evaggelia pitoura, bharat bhargava",1995,acm sigmod record,539087cf20f70186a0d5b53d
information finding in a digital library: the stanford perspective,"tak w. yan, héctor garcía-molina",1995,acm sigmod record,539087cf20f70186a0d5b540
data management research at the mitre corporation,"arnon rosenthal, len seligman, catherine mccollum, barbara blaustein, bhavani thuraisingham, edward lafferty",1995,acm sigmod record,539087cf20f70186a0d5b542
an aspect of query optimization in multidatabase systems,"chiang lee, chia-jung chen, hongjun lu",1995,acm sigmod record,539087cf20f70186a0d5b539
why decision support fails and how to fix it,"ralph kimball, kevin strehlo",1995,acm sigmod record,539087cf20f70186a0d5b544
condition handling in sql persistent stored modules,jeff richey,1995,acm sigmod record,539087cf20f70186a0d5b545
"turmoil at nasa, and numerous funding announcements",xiaolei qian,1995,acm sigmod record,539087cf20f70186a0d5b543
florida international university high performance database research center,"naphtali rishe, wei sun, david barton, yi deng, cyril orji, michael alexopoulos, leonardo loureiro, carlos ordonez, mario sanchez, artyom shaposhnikov",1995,acm sigmod record,539087cf20f70186a0d5b541
metu interoperable database system,"a. dogac, c. dengi, e. kilic, g. ozhan, f. ozcan, s. nural, c. evrendilek, u. halici, b. arpinar, p. koksal, n. kesim, s. mancuhan",1995,acm sigmod record,539087cf20f70186a0d5b53f
algebras for querying text regions (extended abstract),"mariano p. consens, tova milo",1995,pods '95 proceedings of the fourteenth acm sigact-sigmod-sigart symposium on principles of database systems,539087cf20f70186a0d5b6d3
"sequences, datalog and transducers","giansalvatore mecca, anthony j. bonner",1995,pods '95 proceedings of the fourteenth acm sigact-sigmod-sigart symposium on principles of database systems,539087cf20f70186a0d5b6d6
similarity-based queries,"h. v. jagadish, alberto o. mendelzon, tova milo",1995,pods '95 proceedings of the fourteenth acm sigact-sigmod-sigart symposium on principles of database systems,539087cf20f70186a0d5b6da
database metatheory: asking the big queries,christos h. papadimitriou,1995,pods '95 proceedings of the fourteenth acm sigact-sigmod-sigart symposium on principles of database systems,539087cf20f70186a0d5b6d2
proceedings of the fourteenth acm sigact-sigmod-sigart symposium on principles of database systems,mihalis yannakakis,1995,joint acm sigmod intl conference on management of data and acm sigact-sigmod- sigart symposium on principles of database systems,539087cf20f70186a0d5b6cf
measuring infinite relations,"jan chomicki, gabriel kuper",1995,pods '95 proceedings of the fourteenth acm sigact-sigmod-sigart symposium on principles of database systems,539087cf20f70186a0d5b6e5
dense-order constraint databases (extended abstract),"stéphane grumbach, jianwen su",1995,pods '95 proceedings of the fourteenth acm sigact-sigmod-sigart symposium on principles of database systems,539087cf20f70186a0d5b6e3
window query-optimal clustering of spatial objects,"bernd-uwe pagel, hans-werner six, mario winter",1995,pods '95 proceedings of the fourteenth acm sigact-sigmod-sigart symposium on principles of database systems,539087cf20f70186a0d5b6e8
constraint programming and database languages: a tutorial,paris kanellakis,1995,pods '95 proceedings of the fourteenth acm sigact-sigmod-sigart symposium on principles of database systems,539087cf20f70186a0d5b6dd
separability of polyhedra for optimal filtering of spatial and constraint data,"alexander brodsky, catherine lassez, jean-louis lassez, michael j. maher",1995,pods '95 proceedings of the fourteenth acm sigact-sigmod-sigart symposium on principles of database systems,539087cf20f70186a0d5b6df
safe locking policies for dynamic databases,"vinay k. chaudhri, vassos hadzilacos",1995,pods '95 proceedings of the fourteenth acm sigact-sigmod-sigart symposium on principles of database systems,539087cf20f70186a0d5b6ee
combinatorial games in database theory,phokion g. kolaitis,1995,pods '95 proceedings of the fourteenth acm sigact-sigmod-sigart symposium on principles of database systems,539087cf20f70186a0d5b6eb
scheduling problems in parallel query optimization,"chandra chekuri, waqar hasan, rajeev motwani",1995,pods '95 proceedings of the fourteenth acm sigact-sigmod-sigart symposium on principles of database systems,539087cf20f70186a0d5b6f5
on the complexity of bounded-variable queries (extended abstract),moshe y. vardi,1995,pods '95 proceedings of the fourteenth acm sigact-sigmod-sigart symposium on principles of database systems,539087cf20f70186a0d5b6f8
finite queries do not have effective syntax,"alexei p. stolboushkin, michael a. taitslin",1995,pods '95 proceedings of the fourteenth acm sigact-sigmod-sigart symposium on principles of database systems,539087cf20f70186a0d5b6fb
the reliability of queries (extended abstract),michel de rougemont,1995,pods '95 proceedings of the fourteenth acm sigact-sigmod-sigart symposium on principles of database systems,539087cf20f70186a0d5b6fd
"increasing the resilience of atomic commit, at no additional cost","idit keidar, danny dolev",1995,pods '95 proceedings of the fourteenth acm sigact-sigmod-sigart symposium on principles of database systems,539087cf20f70186a0d5b6f2
acm sigmod record,"jennifer widom, margaret h. dunham, abdelsalam helal",1995,acm sigmod record,55911eb00cf232eb904fad35
a research status report on adaptation for mobile data access,"brian d. noble, m. satyanarayanan",1995,acm sigmod record,539087cf20f70186a0d5d016
wireless client/server computing for personal information services and applications,"ahmed elmagarmid, jin jing, tetsuya furukawa",1995,acm sigmod record,539087cf20f70186a0d5d01a
view maintenance in mobile computing,"ouri wolfson, prasad sistla, son dao, kailash narayanan, ramya raj",1995,acm sigmod record,539087cf20f70186a0d5d01c
mobile computing and databases: anything new?,"margaret h. dunham, abdelsalam helal",1995,acm sigmod record,539087cf20f70186a0d5d013
managing video data in a mobile environment,"rafael alonso, yuh-lin chang, liviu iftode, v. s. mani",1995,acm sigmod record,539087cf20f70186a0d5d021
digital library services in mobile computing,"bharat bhargava, melliyal annamalai, evaggelia pitoura",1995,acm sigmod record,539087cf20f70186a0d5d025
parallelism and its price: a case study of nonstop sql/mp,"susanne englert, ray glasstone, waqar hasan",1995,acm sigmod record,539087cf20f70186a0d5d031
temporal database system implementations,michael h. böhlen,1995,acm sigmod record,539087cf20f70186a0d5d02f
the database group at national technical university of athens (ntua),corporate national technical univ. of athens,1995,acm sigmod record,539087cf20f70186a0d5d037
report on the 1995 international workshop on temporal databases,"arie segev, christian s. jensen, richard thomas snodgrass",1995,acm sigmod record,539087cf20f70186a0d5d02c
an annotated bibliography on real-time database systems,özgür ulusoy,1995,acm sigmod record,539087cf20f70186a0d5d02a
"opportunities at arpa, nsf, and elsewhere",xiaolei qian,1995,acm sigmod record,539087cf20f70186a0d5d03d
"replication: db2, oracle, or sybase?",doug stacey,1995,acm sigmod record,539087cf20f70186a0d5d03f
the new middleware,rich finkelstein,1995,acm sigmod record,539087cf20f70186a0d5d041
data and knowledge base research at hong kong university of science and technology,"p. drew, b. hamidzadeh, k. karlapalem, a. kean, d. lee, q. li, f. lochovsky, c. d. shum, b. wuthrich",1995,acm sigmod record,539087cf20f70186a0d5d03a
sql/cli—a new binding style for sql,"murali venkatrao, michael pizzo",1995,acm sigmod record,539087cf20f70186a0d5d034
research problems in genome databases,nathan goodman,1995,pods '95 proceedings of the fourteenth acm sigact-sigmod-sigart symposium on principles of database systems,539087cf20f70186a0d5d1c1
view maintenance issues for the chronicle data model (extended abstract),"h. v. jagadish, inderpal singh mumick, abraham silberschatz",1995,pods '95 proceedings of the fourteenth acm sigact-sigmod-sigart symposium on principles of database systems,539087cf20f70186a0d5d1c0
answering queries using templates with binding patterns (extended abstract),"anand rajaraman, yehoshua sagiv, jeffrey d. ullman",1995,pods '95 proceedings of the fourteenth acm sigact-sigmod-sigart symposium on principles of database systems,539087cf20f70186a0d5d1bf
space-bounded foies (extended abstract),"guozhu dong, jianwen su",1995,pods '95 proceedings of the fourteenth acm sigact-sigmod-sigart symposium on principles of database systems,539087cf20f70186a0d5d1c3
the size of a revised knowledge base,"marco cadoli, francesco m. donini, paolo liberatore, marco schaerf",1995,pods '95 proceedings of the fourteenth acm sigact-sigmod-sigart symposium on principles of database systems,539087cf20f70186a0d5d1c4
answering queries using views (extended abstract),"alon y. levy, alberto o. mendelzon, yehoshua sagiv",1995,pods '95 proceedings of the fourteenth acm sigact-sigmod-sigart symposium on principles of database systems,539087cf20f70186a0d5d1be
structural totality and constraint stratification,kenneth a. ross,1995,pods '95 proceedings of the fourteenth acm sigact-sigmod-sigart symposium on principles of database systems,539087cf20f70186a0d5d1ca
using witness generators to support bi-directional update between object-based databases (extended abstract),"ti-pin chang, richard hull",1995,pods '95 proceedings of the fourteenth acm sigact-sigmod-sigart symposium on principles of database systems,539087cf20f70186a0d5d1cc
applying an update method to a set of receivers (extended abstract),"marc andries, luca cabibbo, jan paredaens, jan van den bussche",1995,pods '95 proceedings of the fourteenth acm sigact-sigmod-sigart symposium on principles of database systems,539087cf20f70186a0d5d1cf
magic factoring of closure programs (extended abstract),peter t. wood,1995,pods '95 proceedings of the fourteenth acm sigact-sigmod-sigart symposium on principles of database systems,539087cf20f70186a0d5d1c8
semantic query optimization in datalog programs (extended abstract),"alon y. levy, yehoshua sagiv",1995,pods '95 proceedings of the fourteenth acm sigact-sigmod-sigart symposium on principles of database systems,539087cf20f70186a0d5d1c6
semantics and expressiveness issues in active databases (extended abstract),"phillippe picouet, victor vianu",1995,pods '95 proceedings of the fourteenth acm sigact-sigmod-sigart symposium on principles of database systems,539087cf20f70186a0d5d1c2
normalizing incomplete databases,leonid libkin,1995,pods '95 proceedings of the fourteenth acm sigact-sigmod-sigart symposium on principles of database systems,539087cf20f70186a0d5d1d0
proceedings of the 1995 acm sigmod international conference on management of data,"michael carey, donovan schneider",1995,joint acm sigmod intl conference on management of data and acm sigact-sigmod- sigart symposium on principles of database systems,539087d420f70186a0d5df09
a critique of ansi sql isolation levels,"hal berenson, phil bernstein, jim gray, jim melton, elizabeth o'neil, patrick o'neil",1995,sigmod '95 proceedings of the 1995 acm sigmod international conference on management of data,539087d420f70186a0d5df0a
the lyric language: querying constraint objects,"alexander brodsky, yoram kornatzky",1995,sigmod '95 proceedings of the 1995 acm sigmod international conference on management of data,539087d420f70186a0d5df0d
ofl: a functional execution model for object query languages,"georges gardarin, fernando machuca, philippe pucheral",1995,sigmod '95 proceedings of the 1995 acm sigmod international conference on management of data,539087d420f70186a0d5df0f
efficient optimistic concurrency control using loosely synchronized clocks,"atul adya, robert gruber, barbara liskov, umesh maheshwari",1995,sigmod '95 proceedings of the 1995 acm sigmod international conference on management of data,539087d420f70186a0d5df0c
nearest neighbor queries,"nick roussopoulos, stephen kelley, frédéric vincent",1995,sigmod '95 proceedings of the 1995 acm sigmod international conference on management of data,539087d420f70186a0d5df11
adaptive parallel aggregation algorithms,"ambuj shatdal, jeffrey f. naughton",1995,sigmod '95 proceedings of the 1995 acm sigmod international conference on management of data,539087d420f70186a0d5df18
a general solution of the n-dimensional b-tree problem,michael freeston,1995,sigmod '95 proceedings of the 1995 acm sigmod international conference on management of data,539087d420f70186a0d5df13
parallel evaluation of multi-join queries,"annita n. wilschut, jan flokstra, peter m. g. apers",1995,sigmod '95 proceedings of the 1995 acm sigmod international conference on management of data,539087d420f70186a0d5df1a
oodb indexing by class-division,"sridhar ramaswamy, paris c. kanellakis",1995,sigmod '95 proceedings of the 1995 acm sigmod international conference on management of data,539087d420f70186a0d5df20
recovery protocols for shared memory database systems,"lory d. molesky, krithi ramamritham",1995,sigmod '95 proceedings of the 1995 acm sigmod international conference on management of data,539087d420f70186a0d5df0b
the handwritten trie: indexing electronic ink,"walid aref, daniel barbará, padmavathi vallabhaneni",1995,sigmod '95 proceedings of the 1995 acm sigmod international conference on management of data,539087d420f70186a0d5df21
the merge/purge problem for large databases,"mauricio a. hernández, salvatore j. stolfo",1995,sigmod '95 proceedings of the 1995 acm sigmod international conference on management of data,539087d420f70186a0d5df1e
implementing crash recovery in quickstore: a performance study,"seth j. white, david j. dewitt",1995,sigmod '95 proceedings of the 1995 acm sigmod international conference on management of data,539087d420f70186a0d5df24
topological relations in the world of minimum bounding rectangles: a study with r-trees,"dimitris papadias, timos sellis, yannis theodoridis, max j. egenhofer",1995,sigmod '95 proceedings of the 1995 acm sigmod international conference on management of data,539087d420f70186a0d5df15
"fastmap: a fast algorithm for indexing, data-mining and visualization of traditional and multimedia datasets","christos faloutsos, king-ip lin",1995,sigmod '95 proceedings of the 1995 acm sigmod international conference on management of data,539087d420f70186a0d5df22
an effective hash-based algorithm for mining association rules,"jong soo park, ming-syan chen, philip s. yu",1995,sigmod '95 proceedings of the 1995 acm sigmod international conference on management of data,539087d420f70186a0d5df23
towards an effective calculus for object query languages,"leonidas fegaras, david maier",1995,sigmod '95 proceedings of the 1995 acm sigmod international conference on management of data,539087d420f70186a0d5df0e
broadcast disks: data management for asymmetric communication environments,"swarup acharya, rafael alonso, michael franklin, stanley zdonik",1995,sigmod '95 proceedings of the 1995 acm sigmod international conference on management of data,539087d420f70186a0d5df26
adapting materialized views after redefinitions,"ashish gupta, inderpal s. mumick, kenneth a. ross",1995,sigmod '95 proceedings of the 1995 acm sigmod international conference on management of data,539087d420f70186a0d5df27
enhancing database correctness: a statistical approach,"wen-chi hou, zhongyang zhang",1995,sigmod '95 proceedings of the 1995 acm sigmod international conference on management of data,539087d420f70186a0d5df3d
semantic assumptions and query evaluation in temporal databases,"claudio bettini, x. sean wang, elisa bertino, sushil jajodia",1995,sigmod '95 proceedings of the 1995 acm sigmod international conference on management of data,539087d420f70186a0d5df40
applying update streams in a soft real-time database system,"b. adelberg, h. garcia-molina, b. kao",1995,sigmod '95 proceedings of the 1995 acm sigmod international conference on management of data,539087d420f70186a0d5df3f
dynamic resource brokering for multi-user query execution,"diane l. davison, goetz graefe",1995,sigmod '95 proceedings of the 1995 acm sigmod international conference on management of data,539087d420f70186a0d5df42
reducing multidatabase query response time by tree balancing,"weimin du, ming-chien shan, umeshwar dayal",1995,sigmod '95 proceedings of the 1995 acm sigmod international conference on management of data,539087d420f70186a0d5df43
hypergraph based reorderings of outer join queries with complex predicates,"gautam bhargava, piyush goel, bala iyer",1995,sigmod '95 proceedings of the 1995 acm sigmod international conference on management of data,539087d420f70186a0d5df44
efficient maintenance of materialized mediated views,"james j. lu, guido moerkotte, joachim schue, v. s. subrahmanian",1995,sigmod '95 proceedings of the 1995 acm sigmod international conference on management of data,539087d420f70186a0d5df47
incremental maintenance of views with duplicates,"timothy griffin, leonid libkin",1995,sigmod '95 proceedings of the 1995 acm sigmod international conference on management of data,539087d420f70186a0d5df46
view maintenance in a warehousing environment,"yue zhuge, héctor garcía-molina, joachim hammer, jennifer widom",1995,sigmod '95 proceedings of the 1995 acm sigmod international conference on management of data,539087d420f70186a0d5df45
the spiffi scalable video-on-demand system,"craig s. freedman, david j. dewitt",1995,sigmod '95 proceedings of the 1995 acm sigmod international conference on management of data,539087d420f70186a0d5df48
fault tolerant design of multimedia servers,"steven berson, leana golubchik, richard r. muntz",1995,sigmod '95 proceedings of the 1995 acm sigmod international conference on management of data,539087d420f70186a0d5df49
upsizing form file server to client server architectures,corporate the access team microsoft,1995,sigmod '95 proceedings of the 1995 acm sigmod international conference on management of data,539087d420f70186a0d5df4f
join queries with external text sources: execution and optimization techniques,"surajit chaudhuri, umeshwar dayal, tak w. yan",1995,sigmod '95 proceedings of the 1995 acm sigmod international conference on management of data,539087d420f70186a0d5df4d
directv and oracle rdb: the challenge of vldb transaction processing,william l. gettys,1995,sigmod '95 proceedings of the 1995 acm sigmod international conference on management of data,539087d420f70186a0d5df51
the lotus notes storage system,kenneth moore,1995,sigmod '95 proceedings of the 1995 acm sigmod international conference on management of data,539087d420f70186a0d5df50
copy detection mechanisms for digital documents,"sergey brin, james davis, héctor garcía-molina",1995,sigmod '95 proceedings of the 1995 acm sigmod international conference on management of data,539087d420f70186a0d5df4c
high availability of commercial applications,kestutis ivinskis,1995,sigmod '95 proceedings of the 1995 acm sigmod international conference on management of data,539087d420f70186a0d5df53
the data that you won't find in databases: tutorial panel on data exchange formats,"peter buneman, david maier",1995,sigmod '95 proceedings of the 1995 acm sigmod international conference on management of data,539087d420f70186a0d5df54
"object-oriented, rapid application development in a pc database environment",corporate fox development team microsoft,1995,sigmod '95 proceedings of the 1995 acm sigmod international conference on management of data,539087d420f70186a0d5df4e
versant replication: supporting fault-tolerant object databases,"yuh-ming shyy, h. stephen au-yeung, c. p. chou",1995,sigmod '95 proceedings of the 1995 acm sigmod international conference on management of data,539087d420f70186a0d5df57
an online video placement policy based on bandwidth to space ratio (bsr),"asit dan, dinkar sitaram",1995,sigmod '95 proceedings of the 1995 acm sigmod international conference on management of data,539087d420f70186a0d5df4a
a database interface for file update,"serge abiteboul, sophie cluet, tova milo",1995,sigmod '95 proceedings of the 1995 acm sigmod international conference on management of data,539087d420f70186a0d5df4b
carnot and infosleuth: database technology and the world wide web,"d. woelk, b. bohrer, n. jacobs, k. ong, c. tomlinson, c. unnikrishnan",1995,sigmod '95 proceedings of the 1995 acm sigmod international conference on management of data,539087d420f70186a0d5df58
data extraction and transformation for the data warehouse,case squire,1995,sigmod '95 proceedings of the 1995 acm sigmod international conference on management of data,539087d420f70186a0d5df5a
real world requirements for decision support—implications for rdbms,sanju k. bansal,1995,sigmod '95 proceedings of the 1995 acm sigmod international conference on management of data,539087d420f70186a0d5df5b
“one size fits all” database architectures do not work for dss,clark d. french,1995,sigmod '95 proceedings of the 1995 acm sigmod international conference on management of data,539087d420f70186a0d5df5c
cover your assets,michael a. olson,1995,sigmod '95 proceedings of the 1995 acm sigmod international conference on management of data,539087d420f70186a0d5df5e
balancing histogram optimality and practicality for query result size estimation,"yannis e. ioannidis, viswanath poosala",1995,sigmod '95 proceedings of the 1995 acm sigmod international conference on management of data,539087d420f70186a0d5df3e
temporal conditions and integrity constraints in active database systems,"a. prasad sistla, ouri wolfson",1995,sigmod '95 proceedings of the 1995 acm sigmod international conference on management of data,539087d420f70186a0d5df41
an overview of db2 parallel edition,"chaitanya baru, gilles fecteau",1995,sigmod '95 proceedings of the 1995 acm sigmod international conference on management of data,539087d420f70186a0d5df61
enterprise objects framework: a second generation object-relational enabler,charly kleissner,1995,sigmod '95 proceedings of the 1995 acm sigmod international conference on management of data,539087d420f70186a0d5df60
informix online xps,bob gerber,1995,sigmod '95 proceedings of the 1995 acm sigmod international conference on management of data,539087d420f70186a0d5df62
order-of-magnitude advantage on tpc-c through massive parallelism,charles levine,1995,sigmod '95 proceedings of the 1995 acm sigmod international conference on management of data,539087d420f70186a0d5df63
use of a component architecture in integrating relational and non-relational,robert atkinson,1995,sigmod '95 proceedings of the 1995 acm sigmod international conference on management of data,539087d420f70186a0d5df5f
objects and sql (panel session): strange relations?,donald r. deutsch,1995,sigmod '95 proceedings of the 1995 acm sigmod international conference on management of data,539087d420f70186a0d5df65
an overview of the emerging third-generation sql standard,"jim melton, nelson mendoca mattos",1995,sigmod '95 proceedings of the 1995 acm sigmod international conference on management of data,539087d420f70186a0d5df66
leveraging the information asset,janet perna,1995,sigmod '95 proceedings of the 1995 acm sigmod international conference on management of data,539087d420f70186a0d5df5d
"workflow automation: applications, technology and research",amit sheth,1995,sigmod '95 proceedings of the 1995 acm sigmod international conference on management of data,539087d420f70186a0d5df67
integration approaches for cim,moira c. norrie,1995,sigmod '95 proceedings of the 1995 acm sigmod international conference on management of data,539087d420f70186a0d5df68
research and products—are they relevant to each other? (panel session),herb edelstein,1995,sigmod '95 proceedings of the 1995 acm sigmod international conference on management of data,539087d420f70186a0d5df59
tutorial on storage technology: raid and beyond,garth a. gibson,1995,sigmod '95 proceedings of the 1995 acm sigmod international conference on management of data,539087d420f70186a0d5df69
datamine—interactive rule discovery system,"t. imielinski, a. virmani",1995,sigmod '95 proceedings of the 1995 acm sigmod international conference on management of data,539087d420f70186a0d5df6a
