Title,Authors,Year,Venue,Index
the next database revolution,jim gray,2004,sigmod '04 proceedings of the 2004 acm sigmod international conference on management of data,5390972920f70186a0dfac85
the role of cryptography in database security,ueli maurer,2004,sigmod '04 proceedings of the 2004 acm sigmod international conference on management of data,5390972920f70186a0dfac86
tree logical classes for efficient evaluation of xquery,"stelios paparizos, yuqing wu, laks v. s. lakshmanan, h. v. jagadish",2004,sigmod '04 proceedings of the 2004 acm sigmod international conference on management of data,5390972920f70186a0dfac8d
adaptive stream resource management using kalman filters,"ankur jain, edward y. chang, yuan-fang wang",2004,sigmod '04 proceedings of the 2004 acm sigmod international conference on management of data,5390972920f70186a0dfac88
holistic udafs at streaming speeds,"graham cormode, theodore johnson, flip korn, s. muthukrishnan, oliver spatscheck, divesh srivastava",2004,sigmod '04 proceedings of the 2004 acm sigmod international conference on management of data,5390972920f70186a0dfac8a
online event-driven subsequence matching over financial data streams,"huanmei wu, betty salzberg, donghui zhang",2004,sigmod '04 proceedings of the 2004 acm sigmod international conference on management of data,5390972920f70186a0dfac89
using the structure of web sites for automatic segmentation of tables,"kristina lerman, lise getoor, steven minton, craig knoblock",2004,sigmod '04 proceedings of the 2004 acm sigmod international conference on management of data,5390972920f70186a0dfac91
flexpath: flexible structure and full-text querying for xml,"sihem amer-yahia, laks v. s. lakshmanan, shashank pandit",2004,sigmod '04 proceedings of the 2004 acm sigmod international conference on management of data,5390972920f70186a0dfac8e
an interactive clustering-based approach to integrating source query interfaces on the deep web,"wensheng wu, clement yu, anhai doan, weiyi meng",2004,sigmod '04 proceedings of the 2004 acm sigmod international conference on management of data,5390972920f70186a0dfac8f
lazy query evaluation for active xml,"serge abiteboul, omar benjelloun, bogdan cautis, ioana manolescu, tova milo, nicoleta preda",2004,sigmod '04 proceedings of the 2004 acm sigmod international conference on management of data,5390972920f70186a0dfac9a
colorful xml: one hierarchy isn't enough,"h. v. jagadish, laks v. s. lakshmanan, monica scannapieco, divesh srivastava, nuwee wiwatwattana",2004,sigmod '04 proceedings of the 2004 acm sigmod international conference on management of data,5390972920f70186a0dfac9c
effective use of block-level sampling in statistics estimation,"surajit chaudhuri, gautam das, utkarsh srivastava",2004,sigmod '04 proceedings of the 2004 acm sigmod international conference on management of data,5390972920f70186a0dfac9f
the priority r-tree: a practically efficient and worst-case optimal r-tree,"lars arge, mark de berg, herman j. haverkort, ke yi",2004,sigmod '04 proceedings of the 2004 acm sigmod international conference on management of data,5390972920f70186a0dfaca4
online maintenance of very large random samples,"christopher jermaine, abhijit pol, subramanian arumugam",2004,sigmod '04 proceedings of the 2004 acm sigmod international conference on management of data,5390972920f70186a0dfaca0
integrating vertical and horizontal partitioning into automated physical database design,"sanjay agrawal, vivek narasayya, beverly yang",2004,sigmod '04 proceedings of the 2004 acm sigmod international conference on management of data,5390972920f70186a0dfaca5
graph indexing: a frequent structure-based approach,"xifeng yan, philip s. yu, jiawei han",2004,sigmod '04 proceedings of the 2004 acm sigmod international conference on management of data,5390972920f70186a0dfaca3
conditional selectivity for statistics on query expressions,"nicolas bruno, surajit chaudhuri",2004,sigmod '04 proceedings of the 2004 acm sigmod international conference on management of data,5390972920f70186a0dfaca1
computing clusters of correlation connected objects,"christian böhm, karin kailing, peer kröger, arthur zimek",2004,sigmod '04 proceedings of the 2004 acm sigmod international conference on management of data,5390972920f70186a0dfacad
transaction support for indexed summary views,"goetz graefe, michael zwilling",2004,sigmod '04 proceedings of the 2004 acm sigmod international conference on management of data,5390972920f70186a0dfaca2
fast computation of database operations using graphics processors,"naga k. govindaraju, brandon lloyd, wei wang, ming lin, dinesh manocha",2004,sigmod '04 proceedings of the 2004 acm sigmod international conference on management of data,5390972920f70186a0dfac99
approximate xml query answers,"neoklis polyzotis, minos garofalakis, yannis ioannidis",2004,sigmod '04 proceedings of the 2004 acm sigmod international conference on management of data,5390972920f70186a0dfac9d
a bi-level bernoulli scheme for database sampling,"peter j. haas, christian könig",2004,sigmod '04 proceedings of the 2004 acm sigmod international conference on management of data,5390972920f70186a0dfac9e
"identifying similarities, periodicities and bursts for online search queries","michail vlachos, christopher meek, zografoula vagena, dimitrios gunopulos",2004,sigmod '04 proceedings of the 2004 acm sigmod international conference on management of data,5390972920f70186a0dfac92
rank-aware query optimization,"ihab f. ilyas, rahul shah, walid g. aref, jeffrey scott vitter, ahmed k. elmagarmid",2004,sigmod '04 proceedings of the 2004 acm sigmod international conference on management of data,5390972920f70186a0dfac98
data stream management for historical xml data,"sujoe bose, leonidas fegaras",2004,sigmod '04 proceedings of the 2004 acm sigmod international conference on management of data,5390972920f70186a0dfac9b
compressing historical information in sensor networks,"antonios deligiannakis, yannis kotidis, nick roussopoulos",2004,sigmod '04 proceedings of the 2004 acm sigmod international conference on management of data,5390972920f70186a0dfacb3
a formal analysis of information disclosure in data exchange,"gerome miklau, dan suciu",2004,sigmod '04 proceedings of the 2004 acm sigmod international conference on management of data,5390972920f70186a0dfacb7
imap: discovering complex semantic matches between database schemas,"robin dhamankar, yoonkyong lee, anhai doan, alon halevy, pedro domingos",2004,sigmod '04 proceedings of the 2004 acm sigmod international conference on management of data,5390972920f70186a0dfaca7
extending query rewriting techniques for fine-grained access control,"shariq rizvi, alberto mendelzon, s. sudarshan, prasan roy",2004,sigmod '04 proceedings of the 2004 acm sigmod international conference on management of data,5390972920f70186a0dfacb5
efficient query reformulation in peer data management systems,"igor tatarinov, alon halevy",2004,sigmod '04 proceedings of the 2004 acm sigmod international conference on management of data,5390972920f70186a0dfacb4
approximation techniques for spatial data,"abhinandan das, johannes gehrke, mirek riedewald",2004,sigmod '04 proceedings of the 2004 acm sigmod international conference on management of data,5390972920f70186a0dfacc1
indexing spatio-temporal trajectories with chebyshev polynomials,"yuhan cai, raymond ng",2004,sigmod '04 proceedings of the 2004 acm sigmod international conference on management of data,5390972920f70186a0dfacb9
toss: an extension of tax with ontologies and similarity queries,"edward hung, yu deng, v. s. subrahmanian",2004,sigmod '04 proceedings of the 2004 acm sigmod international conference on management of data,5390972920f70186a0dfacc3
spatially-decaying aggregation over a network: model and algorithms,"edith cohen, haim kaplan",2004,sigmod '04 proceedings of the 2004 acm sigmod international conference on management of data,5390972920f70186a0dfacc2
buffering databse operations for enhanced instruction cache performance,"jingren zhou, kenneth a. ross",2004,sigmod '04 proceedings of the 2004 acm sigmod international conference on management of data,5390972920f70186a0dfac97
order preserving encryption for numeric data,"rakesh agrawal, jerry kiernan, ramakrishnan srikant, yirong xu",2004,sigmod '04 proceedings of the 2004 acm sigmod international conference on management of data,5390972920f70186a0dfacb6
diamond in the rough: finding hierarchical heavy hitters in multi-dimensional data,"graham cormode, flip korn, s. muthukrishnan, divesh srivastava",2004,sigmod '04 proceedings of the 2004 acm sigmod international conference on management of data,5390972920f70186a0dfac94
understanding web query interfaces: best-effort parsing with hidden syntax,"zhen zhang, bin he, kevin chen-chuan chang",2004,sigmod '04 proceedings of the 2004 acm sigmod international conference on management of data,5390972920f70186a0dfac90
automatic categorization of query results,"kaushik chakrabarti, surajit chaudhuri, seung-won hwang",2004,sigmod '04 proceedings of the 2004 acm sigmod international conference on management of data,5390972920f70186a0dfacc6
optimization of query streams using semantic prefetching,"ivan t. bowman, kenneth salem",2004,sigmod '04 proceedings of the 2004 acm sigmod international conference on management of data,5390972920f70186a0dfac96
cost-based labeling of groups of mass spectra,"lei chen, zheng huang, raghu ramakrishnan",2004,sigmod '04 proceedings of the 2004 acm sigmod international conference on management of data,5390972920f70186a0dfac95
toward a progress indicator for database queries,"gang luo, jeffrey f. naughton, curt j. ellmann, michael w. watzke",2004,sigmod '04 proceedings of the 2004 acm sigmod international conference on management of data,5390972920f70186a0dfacc9
query sampling in db2 universal database,"jarek gryz, junjie guo, linqi liu, calisto zuzarte",2004,sigmod '04 proceedings of the 2004 acm sigmod international conference on management of data,5390972920f70186a0dfaccd
on the integration of structure indexes and inverted lists,"raghav kaushik, rajasekar krishnamurthy, jeffrey f. naughton, raghu ramakrishnan",2004,sigmod '04 proceedings of the 2004 acm sigmod international conference on management of data,5390972920f70186a0dfacc8
estimating progress of execution for sql queries,"surajit chaudhuri, vivek narasayya, ravishankar ramamurthy",2004,sigmod '04 proceedings of the 2004 acm sigmod international conference on management of data,5390972920f70186a0dfacca
when one sample is not enough: improving text database selection using shrinkage,"panagiotis g. ipeirotis, luis gravano",2004,sigmod '04 proceedings of the 2004 acm sigmod international conference on management of data,5390972920f70186a0dfacc7
information-theoretic tools for mining database structure from large data sets,"periklis andritsos, renée j. miller, panayiotis tsaparas",2004,sigmod '04 proceedings of the 2004 acm sigmod international conference on management of data,5390972920f70186a0dfacc4
vertical and horizontal percentage aggregations,carlos ordonez,2004,sigmod '04 proceedings of the 2004 acm sigmod international conference on management of data,5390972920f70186a0dfacd2
blas: an efficient xpath processing system,"yi chen, susan b. davidson, yifeng zheng",2004,sigmod '04 proceedings of the 2004 acm sigmod international conference on management of data,5390972920f70186a0dfac8b
farmer: finding interesting rule groups in microarray datasets,"gao cong, anthony k. h. tung, xin xu, feng pan, jiong yang",2004,sigmod '04 proceedings of the 2004 acm sigmod international conference on management of data,5390972920f70186a0dfac93
efficient processing of xml twig queries with or-predicates,"haifeng jiang, hongjun lu, wei wang",2004,sigmod '04 proceedings of the 2004 acm sigmod international conference on management of data,5390972920f70186a0dfac8c
requirements and policy challenges in highly secure environments,dean e. hall,2004,sigmod '04 proceedings of the 2004 acm sigmod international conference on management of data,5390972920f70186a0dfacda
load management and high availability in the medusa distributed stream processing system,"magdalena balazinska, hari balakrishnan, michael stonebraker",2004,sigmod '04 proceedings of the 2004 acm sigmod international conference on management of data,5390972920f70186a0dface9
streamon: an adaptive engine for stream query processing,"shivnath babu, jennifer widom",2004,sigmod '04 proceedings of the 2004 acm sigmod international conference on management of data,5390972920f70186a0dfacea
maids: mining alarming incidents from data streams,"y. dora cai, david clutter, greg pape, jiawei han, michael welge, loretta auvil",2004,sigmod '04 proceedings of the 2004 acm sigmod international conference on management of data,5390972920f70186a0dface4
web-cam: monitoring the dynamic web to respond to continual queries,"shaveen garg, krithi ramamritham, soumen chakrabarti",2004,sigmod '04 proceedings of the 2004 acm sigmod international conference on management of data,5390972920f70186a0dface8
pipes: a public infrastructure for processing and exploring streams,"jürgen krämer, bernhard seeger",2004,sigmod '04 proceedings of the 2004 acm sigmod international conference on management of data,5390972920f70186a0dface7
datamime™,"masum serazi, vasily malakhov, dongmei ren, amal perera, imad rahal, weihua wu, qiang ding, fei pan, william perrizo",2004,sigmod '04 proceedings of the 2004 acm sigmod international conference on management of data,5390972920f70186a0dface6
lexequal: multilexical matching operator in sql,"a. kumaran, jayant r. haritsa",2004,sigmod '04 proceedings of the 2004 acm sigmod international conference on management of data,5390972920f70186a0dfacf3
managing healthcare data hippocratically,"rakesh agrawal, ameet kini, kristen lefevre, amy wang, yirong xu, diana zhou",2004,sigmod '04 proceedings of the 2004 acm sigmod international conference on management of data,5390972920f70186a0dfacf2
itqs: an integrated transport query system,"b. huang, z. huang, h. li, d. lin, h. lu, y. song",2004,sigmod '04 proceedings of the 2004 acm sigmod international conference on management of data,5390972920f70186a0dfacf4
security of shared data in large systems: state of the art and research directions,"arnon rosenthal, marianne winslett",2004,sigmod '04 proceedings of the 2004 acm sigmod international conference on management of data,5390972920f70186a0dfacf9
efficient development of data migration transformations,"paulo carreira, helena galhardas",2004,sigmod '04 proceedings of the 2004 acm sigmod international conference on management of data,5390972920f70186a0dface2
façade: a fast and effective approach to the discovery of dense clusters in noisy spatial data,"yu qian, gang zhang, kang zhang",2004,sigmod '04 proceedings of the 2004 acm sigmod international conference on management of data,5390972920f70186a0dface5
liquid data for weblogic: integrating enterprise data and services,vinayak borkar,2004,sigmod '04 proceedings of the 2004 acm sigmod international conference on management of data,5390972920f70186a0dface3
camas: a citizen awareness system for crisis mitigation,"sharad mehrotra, carter butts, dmitri v. kalashnikov, nalini venkatasubramanian, kemal altintas, ram hariharan, haimin lee, yiming ma, amnon myers, jehan wickramasuriya, ron eguchi, charles huyck",2004,sigmod '04 proceedings of the 2004 acm sigmod international conference on management of data,5390972920f70186a0dfacf6
knocking the door to the deep web: integrating web query interfaces,"bin he, zhen zhang, kevin chen-chuan chang",2004,sigmod '04 proceedings of the 2004 acm sigmod international conference on management of data,5390972920f70186a0dface1
declarative specification of web applications exploiting web services and workflows,"marco brambilla, stefano ceri, sara comai, marco dario, piero fraternali, ioana manolescu",2004,sigmod '04 proceedings of the 2004 acm sigmod international conference on management of data,5390972920f70186a0dfacdf
yoo-hoo!: building a presence service with xquery and wsdl,"mary fernández, nicola onose, jérôme siméon",2004,sigmod '04 proceedings of the 2004 acm sigmod international conference on management of data,5390972920f70186a0dface0
efficient set joins on similarity predicates,"sunita sarawagi, alok kirpal",2004,sigmod '04 proceedings of the 2004 acm sigmod international conference on management of data,5390972920f70186a0dfacc5
xml in the middle: xquery in the weblogic platform,michael j. carey,2004,sigmod '04 proceedings of the 2004 acm sigmod international conference on management of data,5390972920f70186a0dfacdd
service-oriented bi: towards tight integration of business intelligence into operational applications,"marcus dill, achim kraiss, stefan sigg, thomas zurek",2004,sigmod '04 proceedings of the 2004 acm sigmod international conference on management of data,5390972920f70186a0dfacdc
information assurance technical challenges,nicholas j. multari,2004,sigmod '04 proceedings of the 2004 acm sigmod international conference on management of data,5390972920f70186a0dfacdb
dbswitch™: towards a database utility,"shaul dar, gil hecht, eden shochat",2004,sigmod '04 proceedings of the 2004 acm sigmod international conference on management of data,5390972920f70186a0dfacd9
model-driven business ui based on maps,per bendsen,2004,sigmod '04 proceedings of the 2004 acm sigmod international conference on management of data,5390972920f70186a0dfacd8
soundcompass: a practical query-by-humming system; normalization of scalable and shiftable time-series data and effective subsequence generation,"naoko kosugi, yasushi sakurai, masashi morimoto",2004,sigmod '04 proceedings of the 2004 acm sigmod international conference on management of data,5390972920f70186a0dfacd7
enabling sovereign information sharing using web services,"rakesh agrawal, dmitri asonov, ramakrishnan srikant",2004,sigmod '04 proceedings of the 2004 acm sigmod international conference on management of data,5390972920f70186a0dfacd4
"secure, reliable, transacted: innovation in web services architecture",martin gudgin,2004,sigmod '04 proceedings of the 2004 acm sigmod international conference on management of data,5390972920f70186a0dfacd6
"highly available, fault-tolerant, parallel dataflows","mehul a. shah, joseph m. hellerstein, eric brewer",2004,sigmod '04 proceedings of the 2004 acm sigmod international conference on management of data,5390972920f70186a0dfaccc
parallel sql execution in oracle 10g,"thierry cruanes, benoit dageville, bhaskar ghosh",2004,sigmod '04 proceedings of the 2004 acm sigmod international conference on management of data,5390972920f70186a0dfaccf
"relaxed currency and consistency: how to say ""good enough"" in sql","hongfei guo, per-åke larson, raghu ramakrishnan, jonathan goldstein",2004,sigmod '04 proceedings of the 2004 acm sigmod international conference on management of data,5390972920f70186a0dfaccb
building dynamic application networks with web services,matthew mihic,2004,sigmod '04 proceedings of the 2004 acm sigmod international conference on management of data,5390972920f70186a0dfacd5
hosting the .net runtime in microsoft sql server,"alazel acheson, mason bendixen, josé a. blakeley, peter carlin, ebru ersan, jun fang, xiaowei jiang, christian kleinerman, balaji rathakrishnan, gideon schaller, beysim sezgin, ramachandran venkatesh, honggang zhang",2004,sigmod '04 proceedings of the 2004 acm sigmod international conference on management of data,5390972920f70186a0dfacd1
models for web services tansactions,mark little,2004,sigmod '04 proceedings of the 2004 acm sigmod international conference on management of data,5390972920f70186a0dfacd3
data densification in a relational database system,"abhinav gupta, sankar subramanian, srikanth bellamkonda, tolga bozkaya, nathan folkert, lei sheng, andrew witkowski",2004,sigmod '04 proceedings of the 2004 acm sigmod international conference on management of data,5390972920f70186a0dfacd0
query processing for sql updates,"césar a. galindo-legaria, stefano stefani, florian waas",2004,sigmod '04 proceedings of the 2004 acm sigmod international conference on management of data,5390972920f70186a0dfacce
secure xml querying with security views,"wenfei fan, chee-yong chan, minos garofalakis",2004,sigmod '04 proceedings of the 2004 acm sigmod international conference on management of data,5390972920f70186a0dfacb8
joining interval data in relational databases,"jost enderle, matthias hampel, thomas seidl",2004,sigmod '04 proceedings of the 2004 acm sigmod international conference on management of data,5390972920f70186a0dfacc0
sina: scalable incremental processing of continuous queries in spatio-temporal databases,"mohamed f. mokbel, xiaopeing xiong, walid g. aref",2004,sigmod '04 proceedings of the 2004 acm sigmod international conference on management of data,5390972920f70186a0dfacbb
cords: automatic discovery of correlations and soft functional dependencies,"ihab f. ilyas, volker markl, peter haas, paul brown, ashraf aboulnaga",2004,sigmod '04 proceedings of the 2004 acm sigmod international conference on management of data,5390972920f70186a0dfacbd
robust query processing through progressive optimization,"volker markl, vijayshankar raman, david simmen, guy lohman, hamid pirahesh, miso cilimdzic",2004,sigmod '04 proceedings of the 2004 acm sigmod international conference on management of data,5390972920f70186a0dfacbe
prediction and indexing of moving objects with unknown motion patterns,"yufei tao, christos faloutsos, dimitris papadias, bin liu",2004,sigmod '04 proceedings of the 2004 acm sigmod international conference on management of data,5390972920f70186a0dfacba
stripes: an efficient index for predicted trajectories,"jignesh m. patel, yun chen, v. prasad chakka",2004,sigmod '04 proceedings of the 2004 acm sigmod international conference on management of data,5390972920f70186a0dfacbc
canonical abstraction for outerjoin optimization,"jun rao, hamid pirahesh, calisto zuzarte",2004,sigmod '04 proceedings of the 2004 acm sigmod international conference on management of data,5390972920f70186a0dfacbf
the price of validity in dynamic networks,"mayank bawa, aristides gionis, hector garcia-molina, rajeev motwani",2004,sigmod '04 proceedings of the 2004 acm sigmod international conference on management of data,5390972920f70186a0dfacb2
static optimization of conjunctive queries with sliding windows over infinite streams,"ahmed m. ayad, jeffrey f. naughton",2004,sigmod '04 proceedings of the 2004 acm sigmod international conference on management of data,5390972920f70186a0dfacaa
adapting to source properties in processing data integration queries,"zachary g. ives, alon y. halevy, daniel s. weld",2004,sigmod '04 proceedings of the 2004 acm sigmod international conference on management of data,5390972920f70186a0dfaca8
constraint-based xml query rewriting for data integration,"cong yu, lucian popa",2004,sigmod '04 proceedings of the 2004 acm sigmod international conference on management of data,5390972920f70186a0dfaca6
clustering objects on a spatial network,"man lung yiu, nikos mamoulis",2004,sigmod '04 proceedings of the 2004 acm sigmod international conference on management of data,5390972920f70186a0dfacac
dynamic plan migration for continuous queries over data streams,"yali zhu, elke a. rundensteiner, george t. heineman",2004,sigmod '04 proceedings of the 2004 acm sigmod international conference on management of data,5390972920f70186a0dfacab
incremental evaluation of schema-directed xml publishing,"philip bohannon, byron choi, wenfei fan",2004,sigmod '04 proceedings of the 2004 acm sigmod international conference on management of data,5390972920f70186a0dfacb1
incremental and effective data summarization for dynamic hierarchical clustering,"samer nassar, jörg sander, corrine cheng",2004,sigmod '04 proceedings of the 2004 acm sigmod international conference on management of data,5390972920f70186a0dfacae
implementing a scalable xml publish/subscribe system using relational database systems,"feng tian, berthold reinwald, hamid pirahesh, tobias mayr, jussi myllymaki",2004,sigmod '04 proceedings of the 2004 acm sigmod international conference on management of data,5390972920f70186a0dfacaf
adaptive ordering of pipelined stream filters,"shivnath babu, rajeev motwani, kamesh munagala, itaru nishizawa, jennifer widom",2004,sigmod '04 proceedings of the 2004 acm sigmod international conference on management of data,5390972920f70186a0dfaca9
incremental maintenance of xml structural indexes,"ke yi, hao he, ioana stanoi, jun yang",2004,sigmod '04 proceedings of the 2004 acm sigmod international conference on management of data,5390972920f70186a0dfacb0
tools for design of composite web services,"richard hull, jianwen su",2004,sigmod '04 proceedings of the 2004 acm sigmod international conference on management of data,5390972920f70186a0dfacf8
indexing and mining streams,christos faloutsos,2004,sigmod '04 proceedings of the 2004 acm sigmod international conference on management of data,5390972920f70186a0dfacfb
"fast algorithms for time series with applications to finance, physics, music, biology, and other suspects","alberto lerner, dennis shasha, zhihua wang, xiaojian zhao, yunyue zhu",2004,sigmod '04 proceedings of the 2004 acm sigmod international conference on management of data,5390972920f70186a0dfacfa
rethinking the conference reviewing process,"michael j. franklin, jennifer widom, anastassia ailamaki, philip a. bernstein, david dewitt, alon halevy, zachary ives, gerhard weikum",2004,sigmod '04 proceedings of the 2004 acm sigmod international conference on management of data,5390972920f70186a0dfacf7
bodhi: a database habitat for bio-diversity information,"srikanta j. bedathur, abhijit kadlag, jayant r. haritsa",2004,sigmod '04 proceedings of the 2004 acm sigmod international conference on management of data,5390972920f70186a0dfacf5
