Title,Authors,Year,Venue,Index
inferring function semantics to optimize queries,"mitch cherniack, stanley b. zdonik",1998,vldb '98 proceedings of the 24rd international conference on very large data bases,53908a7420f70186a0da4530
safely and efficiently updating references during on-line reorganization,"chendong zou, betty salzberg",1998,vldb '98 proceedings of the 24rd international conference on very large data bases,53908a7420f70186a0da4535
on the discovery of interesting patterns in association rules,"sridhar ramaswamy, sameer mahajan, abraham silberschatz",1998,vldb '98 proceedings of the 24rd international conference on very large data bases,53908a7420f70186a0da4529
on optimal node splitting for r-trees,"yván j. garcía, mario a. lopez, scott t. leutenegger",1998,vldb '98 proceedings of the 24rd international conference on very large data bases,53908a7420f70186a0da453b
secure buffering in firm real-time database systems,"binto george, jayant r. haritsa",1998,vldb '98 proceedings of the 24rd international conference on very large data bases,53908a7420f70186a0da453d
bridging heterogeneity: research and practice of database middleware technology,"fernando de ferreira rezende, günter sauter",1998,vldb '98 proceedings of the 24rd international conference on very large data bases,53908a7420f70186a0da4542
the heterogeneity problem and middleware technology: experiences with and performance of database gateways,"fernando de ferreira rezende, klaudia hergula",1998,vldb '98 proceedings of the 24rd international conference on very large data bases,53908a7420f70186a0da4541
incremental maintenance for materialized views over semistructured data,"serge abiteboul, jason mchugh, michael rys, vasilis vassalos, janet l. wiener",1998,vldb '98 proceedings of the 24rd international conference on very large data bases,53908a7420f70186a0da452b
algorithms for mining association rules for binary segmentations of huge categorical databases,"yasuhiko morimoto, takeshi fukuda, hirofumi matsuzawa, takeshi tokuyama, kunikazu yoda",1998,vldb '98 proceedings of the 24rd international conference on very large data bases,53908a7420f70186a0da4539
dataguides: enabling query formulation and optimization in semistructured databases,"roy goldman, jennifer widom",1997,vldb '97 proceedings of the 23rd international conference on very large data bases,53908a7420f70186a0da4487
public: a decision tree classifier that integrates building and pruning,"rajeev rastogi, kyuseok shim",1998,vldb '98 proceedings of the 24rd international conference on very large data bases,53908a7420f70186a0da4536
starting (and sometimes ending) a database company,jack a. orenstein,1998,vldb '98 proceedings of the 24rd international conference on very large data bases,53908a7420f70186a0da4531
diag-join: an opportunistic join algorithm for 1:n relationships,"sven helmer, till westmann, guido moerkotte",1998,vldb '98 proceedings of the 24rd international conference on very large data bases,53908a7420f70186a0da4544
selectivity estimation in extensible databases - a neural network approach,"m. seetha lakshmi, shaoyu zhou",1998,vldb '98 proceedings of the 24rd international conference on very large data bases,53908a7420f70186a0da4547
materialized view selection for multidimensional datasets,"amit shukla, prasad deshpande, jeffrey f. naughton",1998,vldb '98 proceedings of the 24rd international conference on very large data bases,53908a7420f70186a0da453c
determining text databases to search in the internet,"weiyi meng, king-lup liu, clement t. yu, xiaodong wang, yuhsi chang, naphtali rishe",1998,vldb '98 proceedings of the 24rd international conference on very large data bases,53908a7420f70186a0da4538
low-cost compensation-based query processing,"øystein grøvlen, svein-olaf hvasshovd, øystein torbjørnsen",1998,vldb '98 proceedings of the 24rd international conference on very large data bases,53908a7420f70186a0da454b
clustering categorical data: an approach based on dynamical systems,"david gibson, jon m. kleinberg, prabhakar raghavan",1998,vldb '98 proceedings of the 24rd international conference on very large data bases,53908a7420f70186a0da4549
incremental clustering for mining in a data warehousing environment,"martin ester, hans-peter kriegel, jörg sander, michael wimmer, xiaowei xu",1998,vldb '98 proceedings of the 24rd international conference on very large data bases,53908a7420f70186a0da4548
querying continuous time sequences,"ling lin, tore risch",1998,vldb '98 proceedings of the 24rd international conference on very large data bases,53908a7420f70186a0da44a0
a quantitative analysis and performance study for similarity-search methods in high-dimensional spaces,"roger weber, hans-jörg schek, stephen blott",1998,vldb '98 proceedings of the 24rd international conference on very large data bases,53908a7420f70186a0da453f
plan-per-tuple optimization solution - parallel execution of expensive user-defined functions,"felipe cariño, william o'connell",1998,vldb '98 proceedings of the 24rd international conference on very large data bases,53908a7420f70186a0da449e
"don't scrap it, wrap it! a wrapper architecture for legacy data sources","mary tork roth, peter m. schwarz",1997,vldb '97 proceedings of the 23rd international conference on very large data bases,53908a7420f70186a0da4477
architecture of oracle parallel server,"roger bamford, d. butler, boris klots, n. macnaughton",1998,vldb '98 proceedings of the 24rd international conference on very large data bases,53908a7420f70186a0da4496
integrating sql databases with content-specific search engines,"stefan deßloch, nelson mendonça mattos",1997,vldb '97 proceedings of the 23rd international conference on very large data bases,53908a7420f70186a0da448b
bulk-loading techniques for object databases and an application to relational data,"sihem amer-yahia, sophie cluet, claude delobel",1998,vldb '98 proceedings of the 24rd international conference on very large data bases,53908a7420f70186a0da45c3
design and analysis of parametric query optimization algorithms,sumit ganguly,1998,vldb '98 proceedings of the 24rd international conference on very large data bases,53908a7420f70186a0da45c8
"information, communication, and money: for what can we charge and how can we meter it?","stephen blott, henry f. korth, abraham silberschatz",1998,vldb '98 proceedings of the 24rd international conference on very large data bases,53908a7420f70186a0da45cc
buffering and read-ahead strategies for external mergesort,"weiye zhang, per-åke larson",1998,vldb '98 proceedings of the 24rd international conference on very large data bases,53908a7420f70186a0da45cb
from data independence to knowledge independence: an on-going story,laurent vieille,1998,vldb '98 proceedings of the 24rd international conference on very large data bases,53908a7420f70186a0da45cf
dtl's dataspot: database exploration using plain language,"shaul dar, gadi entin, shai geva, eran palmon",1998,vldb '98 proceedings of the 24rd international conference on very large data bases,53908a7420f70186a0da45c4
evaluating functional joins along nested reference sets in object-relational and object-oriented databases,"reinhard braumandl, jens claußen, alfons kemper",1998,vldb '98 proceedings of the 24rd international conference on very large data bases,53908a7420f70186a0da45d4
performance measurements of tertiary storage devices,"theodore johnson, ethan l. miller",1998,vldb '98 proceedings of the 24rd international conference on very large data bases,53908a7420f70186a0da45c6
atomicity versus anonymity: distributed transactions for electronic commerce,j. d. tygar,1998,vldb '98 proceedings of the 24rd international conference on very large data bases,53908a7420f70186a0da45d6
materialized views in oracle,"randall g. bello, karl dias, alan downing, james j. feenan, jr., james l. finnerty, william d. norcott, harry sun, andrew witkowski, mohamed ziauddin",1998,vldb '98 proceedings of the 24rd international conference on very large data bases,53908a7420f70186a0da45ce
rainforest - a framework for fast decision tree construction of large datasets,"johannes gehrke, raghu ramakrishnan, venkatesh ganti",1998,vldb '98 proceedings of the 24rd international conference on very large data bases,53908a7420f70186a0da45c9
microsoft english query 7.5: automatic extraction of semantics from relational databases and olap cubes,adam blum,1999,vldb '99 proceedings of the 25th international conference on very large data bases,53908a7420f70186a0da45db
"topaz: a cost-based, rule-driven, multi-phase parallelizer","clara nippl, bernhard mitschang",1998,vldb '98 proceedings of the 24rd international conference on very large data bases,53908a7420f70186a0da45d0
binding propagation in disjunctive databases,sergio greco,1998,vldb '98 proceedings of the 24rd international conference on very large data bases,53908a7420f70186a0da45d7
"the new locking, logging, and recovery architecture of microsoft sql server 7.0",david campbell,1999,vldb '99 proceedings of the 25th international conference on very large data bases,53908a7420f70186a0da45e0
r-tree based indexing of now-relative bitemporal data,"rasa bliujute, christian s. jensen, simonas saltenis, giedrius slivinskas",1998,vldb '98 proceedings of the 24rd international conference on very large data bases,53908a7420f70186a0da45d2
curio: a novel solution for efficient storage and indexing in data warehouses,"anindya datta, krithi ramamritham, helen m. thomas",1999,vldb '99 proceedings of the 25th international conference on very large data bases,53908a7420f70186a0da45df
unrolling cycles to decide trigger termination,"sin yeung lee, tok wang ling",1999,vldb '99 proceedings of the 25th international conference on very large data bases,53908a7420f70186a0da45e1
building light-weight wrappers for legacy web data-sources using w4f,"arnaud sahuguet, fabien azavant",1999,vldb '99 proceedings of the 25th international conference on very large data bases,53908a7420f70186a0da45dd
high-performance extensible indexing,marcel kornacker,1999,vldb '99 proceedings of the 25th international conference on very large data bases,53908a7420f70186a0da45e5
performance measurements of compressed bitmap indices,theodore johnson,1999,vldb '99 proceedings of the 25th international conference on very large data bases,53908a7420f70186a0da45de
scalable sweeping-based spatial join,"lars arge, octavian procopiuc, sridhar ramaswamy, torsten suel, jeffrey scott vitter",1998,vldb '98 proceedings of the 24rd international conference on very large data bases,53908a7420f70186a0da45d3
aggregation algorithms for very large compressed data warehouses,"jianzhong li, doron rotem, jaideep srivastava",1999,vldb '99 proceedings of the 25th international conference on very large data bases,53908a7420f70186a0da45e2
wavecluster: a multi-resolution clustering approach for very large spatial databases,"gholamhosein sheikholeslami, surojit chatterjee, aidong zhang",1998,vldb '98 proceedings of the 24rd international conference on very large data bases,53908a7420f70186a0da45d5
quality-driven integration of heterogenous information systems,"felix naumann, ulf leser, johann christoph freytag",1999,vldb '99 proceedings of the 25th international conference on very large data bases,53908a7420f70186a0da45e3
voodb: a generic discrete-event random simulation model to evaluate the performances of oodbs,"jérôme darmont, michel schneider",1999,vldb '99 proceedings of the 25th international conference on very large data bases,53908a7420f70186a0da45e8
mindreader: querying databases through multiple examples,"yoshiharu ishikawa, ravishankar subramanya, christos faloutsos",1998,vldb '98 proceedings of the 24rd international conference on very large data bases,53908a7420f70186a0da45ca
an adaptive hybrid server architecture for client caching odbmss,"kaladhar voruganti, m. tamer özsu, ronald c. unrau",1999,vldb '99 proceedings of the 25th international conference on very large data bases,53908a7420f70186a0da45ea
using schema matching to simplify heterogeneous data translation,"tova milo, sagit zohar",1998,vldb '98 proceedings of the 24rd international conference on very large data bases,53908a7420f70186a0da45c5
active storage for large-scale data mining and multimedia,"erik riedel, garth a. gibson, christos faloutsos",1998,vldb '98 proceedings of the 24rd international conference on very large data bases,53908a7420f70186a0da45d8
proximity search in databases,"roy goldman, narayanan shivakumar, suresh venkatasubramanian, hector garcia-molina",1998,vldb '98 proceedings of the 24rd international conference on very large data bases,53908a7420f70186a0da45d9
hierarchical prefix cubes for range-sum queries,"chee yong chan, yannis e. ioannidis",1999,vldb '99 proceedings of the 25th international conference on very large data bases,53908a7420f70186a0da45ec
query optimization for xml,"jason mchugh, jennifer widom",1999,vldb '99 proceedings of the 25th international conference on very large data bases,53908a7420f70186a0da45dc
computing iceberg queries efficiently,"min fang, narayanan shivakumar, hector garcia-molina, rajeev motwani, jeffrey d. ullman",1998,vldb '98 proceedings of the 24rd international conference on very large data bases,53908a7420f70186a0da45d1
database architecture optimized for the new bottleneck: memory access,"peter a. boncz, stefan manegold, martin l. kersten",1999,vldb '99 proceedings of the 25th international conference on very large data bases,53908a7420f70186a0da45eb
optimal histograms with quality guarantees,"h. v. jagadish, nick koudas, s. muthukrishnan, viswanath poosala, kenneth c. sevcik, torsten suel",1998,vldb '98 proceedings of the 24rd international conference on very large data bases,53908a7420f70186a0da453e
massive stochastic testing of sql,donald r. slutz,1998,vldb '98 proceedings of the 24rd international conference on very large data bases,53908a7420f70186a0da4546
the national medical knowledge bank,warren sterling,1998,vldb '98 proceedings of the 24rd international conference on very large data bases,53908a7420f70186a0da454a
improving adaptable similarity query processing by using approximations,"mihael ankerst, bernhard braunmüller, hans-peter kriegel, thomas seidl",1998,vldb '98 proceedings of the 24rd international conference on very large data bases,53908a7420f70186a0da4545
a raster approximation for processing of spatial joins,"geraldo zimbrao, jano moreira de souza",1998,vldb '98 proceedings of the 24rd international conference on very large data bases,53908a7420f70186a0da4543
resource scheduling for composite multimedia objects,"minos n. garofalakis, yannis e. ioannidis, banu özden",1998,vldb '98 proceedings of the 24rd international conference on very large data bases,53908a7420f70186a0da4540
algorithms for querying by spatial structure,"dimitris papadias, nikos mamoulis, vasilis delis",1998,vldb '98 proceedings of the 24rd international conference on very large data bases,53908a7420f70186a0da4522
checkpointing in oracle,"ashok joshi, william bridge, juan loaiza, tirthankar lahiri",1998,vldb '98 proceedings of the 24rd international conference on very large data bases,53908a7420f70186a0da4537
ibm's db2 universal database demonstrations at vldb'98,"k. bernhard schiefer, jim kleewein, karen brannon, guy m. lohman, gene fuh",1998,vldb '98 proceedings of the 24rd international conference on very large data bases,53908a7420f70186a0da453a
technology and the future of commerce and finance (abstract),david elliot shaw,1998,vldb '98 proceedings of the 24rd international conference on very large data bases,53908a7420f70186a0da4528
issues in network management in the next millennium,"michael l. brodie, surajit chaudhuri",1999,vldb '99 proceedings of the 25th international conference on very large data bases,53908a7420f70186a0da466b
in cyber space no one can hear you scream,chris pound,1999,vldb '99 proceedings of the 25th international conference on very large data bases,53908a7420f70186a0da4669
xml repository and active views demonstration,"serge abiteboul, vincent aguilera, sébastien ailleret, bernd amann, sophie cluet, brendan hills, frédéric hubert, jean-claude mamou, amélie marian, laurent mignet, tova milo, cassio souza dos santos, bruno tessier, anne-marie vercoustre",1999,vldb '99 proceedings of the 25th international conference on very large data bases,53908a7420f70186a0da4670
"industrial panel on data warehousing technologies: experiences, challenges, and directions",umeshwar dayal,1999,vldb '99 proceedings of the 25th international conference on very large data bases,53908a7420f70186a0da4675
high level indexing of user-defined types,"weidong chen, jyh-herng chow, you-chin fuh, jean grandbois, michelle jou, nelson mendonça mattos, brian t. tran, yun wang",1999,vldb '99 proceedings of the 25th international conference on very large data bases,53908a7420f70186a0da466f
networked data management design points,james r. hamilton,1999,vldb '99 proceedings of the 25th international conference on very large data bases,53908a7420f70186a0da467b
a scalable and highly available networked database architecture,"roger bamford, rafiul ahad, angelo pruscino",1999,vldb '99 proceedings of the 25th international conference on very large data bases,53908a7420f70186a0da467c
ghost: fine granularity buffering of indexes,"cheng hian goh, beng chin ooi, d. sim, kian-lee tan",1999,vldb '99 proceedings of the 25th international conference on very large data bases,53908a7420f70186a0da467a
multi-dimensional substring selectivity estimation,"h. v. jagadish, olga kapitskaia, raymond t. ng, divesh srivastava",1999,vldb '99 proceedings of the 25th international conference on very large data bases,53908a7420f70186a0da4674
context-based prefetch for implementing objects on relations,"philip a. bernstein, shankar pal, david shutt",1999,vldb '99 proceedings of the 25th international conference on very large data bases,53908a7420f70186a0da4671
optimization of run-time management of data intensive web-sites,"daniela florescu, alon y. levy, dan suciu, khaled yagoub",1999,vldb '99 proceedings of the 25th international conference on very large data bases,53908a7420f70186a0da466c
spatio-temporal retrieval with rasdaman,"peter baumann, andreas dehmel, paula furtado, roland ritsch, norbert widmann",1999,vldb '99 proceedings of the 25th international conference on very large data bases,53908a7420f70186a0da4680
generalised hash teams for join and group-by,"alfons kemper, donald kossmann, christian wiesner",1999,vldb '99 proceedings of the 25th international conference on very large data bases,53908a7420f70186a0da4679
miro web: integrating multiple data sources through semistructured data types,"luc bouganim, tatiana chan-sine-ying, tuyet-tram dang-ngoc, jean-luc darroux, georges gardarin, fei sha",1999,vldb '99 proceedings of the 25th international conference on very large data bases,53908a7420f70186a0da4685
"pm3: an orthogonal persistent systems programming language - design, implementation, performance","antony l. hosking, jiawan chen",1999,vldb '99 proceedings of the 25th international conference on very large data bases,53908a7420f70186a0da4676
online feedback for nested aggregate queries with multi-threading,"kian-lee tan, cheng hian goh, beng chin ooi",1999,vldb '99 proceedings of the 25th international conference on very large data bases,53908a7420f70186a0da4686
a novel index supporting high volume data warehouse insertion,"chris jermaine, anindya datta, edward omiecinski",1999,vldb '99 proceedings of the 25th international conference on very large data bases,53908a7420f70186a0da4684
optimal grid-clustering: towards breaking the curse of dimensionality in high-dimensional clustering,"alexander hinneburg, daniel a. keim",1999,vldb '99 proceedings of the 25th international conference on very large data bases,53908a7420f70186a0da4678
user-defined table operators: enhancing extensibility for ordbms,"michael jaedicke, bernhard mitschang",1999,vldb '99 proceedings of the 25th international conference on very large data bases,53908a7420f70186a0da4682
extending practical pre-aggregation in on-line analytical processing,"torben bach pedersen, christian s. jensen, curtis e. dyreson",1999,vldb '99 proceedings of the 25th international conference on very large data bases,53908a7420f70186a0da466a
"o-o, what have they done to db2?","michael j. carey, donald d. chamberlin, srinivasa narayanan, bennet vance, doug doole, serge rielau, richard swagerman, nelson mendonça mattos",1999,vldb '99 proceedings of the 25th international conference on very large data bases,53908a7420f70186a0da4689
fast algorithms for maintaining replica consistency in lazy master replicated databases,"esther pacitti, pascale minet, eric simon",1999,vldb '99 proceedings of the 25th international conference on very large data bases,53908a7420f70186a0da4688
the value of merge-join and hash-join in sql server,goetz graefe,1999,vldb '99 proceedings of the 25th international conference on very large data bases,53908a7420f70186a0da468f
extracting large-scale knowledge bases from the web,"ravi kumar, prabhakar raghavan, sridhar rajagopalan, andrew tomkins",1999,vldb '99 proceedings of the 25th international conference on very large data bases,53908a7420f70186a0da467f
"data-driven, one-to-one web site generation for data-intensive applications","stefano ceri, piero fraternali, stefano paraboschi",1999,vldb '99 proceedings of the 25th international conference on very large data bases,53908a7420f70186a0da468b
the mirror mmdbms architecture,"arjen p. de vries, mark g. l. m. van doorn, henk m. blanken, peter m. g. apers",1999,vldb '99 proceedings of the 25th international conference on very large data bases,53908a7420f70186a0da4691
distributed hypertext resource discovery through examples,"soumen chakrabarti, martin van den berg, byron dom",1999,vldb '99 proceedings of the 25th international conference on very large data bases,53908a7420f70186a0da468a
spirit: sequential pattern mining with regular expression constraints,"minos n. garofalakis, rajeev rastogi, kyuseok shim",1999,vldb '99 proceedings of the 25th international conference on very large data bases,53908a7420f70186a0da4681
histogram-based approximation of set-valued query-answers,"yannis e. ioannidis, viswanath poosala",1999,vldb '99 proceedings of the 25th international conference on very large data bases,53908a7420f70186a0da468e
finding intensional knowledge of distance-based outliers,"edwin m. knorr, raymond t. ng",1999,vldb '99 proceedings of the 25th international conference on very large data bases,53908a7420f70186a0da4690
relational databases for querying xml documents: limitations and opportunities,"jayavel shanmugasundaram, kristin tufte, chun zhang, gang he, david j. dewitt, jeffrey f. naughton",1999,vldb '99 proceedings of the 25th international conference on very large data bases,53908a7420f70186a0da4672
similarity search in high dimensions via hashing,"aristides gionis, piotr indyk, rajeev motwani",1999,vldb '99 proceedings of the 25th international conference on very large data bases,53908a7420f70186a0da4683
algorithms for mining distance-based outliers in large datasets,"edwin m. knorr, raymond t. ng",1998,vldb '98 proceedings of the 24rd international conference on very large data bases,53908a7420f70186a0da45cd
evaluating top-k selection queries,"surajit chaudhuri, luis gravano",1999,vldb '99 proceedings of the 25th international conference on very large data bases,53908a7420f70186a0da45e6
cache conscious indexing for decision-support in main memory,"jun rao, kenneth a. ross",1999,vldb '99 proceedings of the 25th international conference on very large data bases,53908a7420f70186a0da45e9
implementation of two semantic query optimization techniques in db2 universal database,"qi cheng, jarek gryz, fred koo, t. y. cliff leung, linqi liu, xiaoyan qian, k. bernhard schiefer",1999,vldb '99 proceedings of the 25th international conference on very large data bases,53908a7420f70186a0da45e4
building hierarchical classifiers using class proximity,"ke wang, senqiang zhou, shiang chen liew",1999,vldb '99 proceedings of the 25th international conference on very large data bases,53908a7420f70186a0da45e7
aqua: a fast decision support systems using approximate query answers,"swarup acharya, phillip b. gibbons, viswanath poosala",1999,vldb '99 proceedings of the 25th international conference on very large data bases,53908a7420f70186a0da45da
mining surprising patterns using temporal description length,"soumen chakrabarti, sunita sarawagi, byron dom",1998,vldb '98 proceedings of the 24rd international conference on very large data bases,53908a7420f70186a0da45c7
repeating history beyond aries,c. mohan,1999,vldb '99 proceedings of the 25th international conference on very large data bases,53908a7420f70186a0da468d
on efficiently implementing schemasql on an sql database system,"laks v. s. lakshmanan, fereidoon sadri, subbu n. subramanian",1999,vldb '99 proceedings of the 25th international conference on very large data bases,53908a7420f70186a0da467e
"active storage hierarchy, database systems and applications - socratic exegesis","felipe cariño, william o'connell, john burgess, joel h. saltz",1999,vldb '99 proceedings of the 25th international conference on very large data bases,53908a7420f70186a0da468c
exploiting versions for handling updates in broadcast disks,"evaggelia pitoura, panos k. chrysanthis",1999,vldb '99 proceedings of the 25th international conference on very large data bases,53908a7420f70186a0da4677
implementation of sql3 structured types with inheritance and value substitutability,"you-chin fuh, stefan deßloch, weidong chen, nelson mendonça mattos, brian t. tran, bruce g. lindsay, linda demichel, serge rielau, danko mannhaupt",1999,vldb '99 proceedings of the 25th international conference on very large data bases,53908a7420f70186a0da4687
